Pregunta,respuesta,Tema,Pers/empresa,Polarity,Nota,ambiguedad
"cuanto seria mi liquidacion al jubilarme con 65 años y 362 aprtaciones de os cuales 360 son ininterrupidas en una institucion de Estado
mi sueldo es 1200 desde hace 6 años",,IESS,,,,
cuanto tiempo se demoran en una nota tecnica de medicina prepagada?,,Consultoria,,,,
Cundos años  me baltan para jubilarme,,IESS,,,,ambivalente
Cundos años  me baltan para jubilarme,,Jubilacion Patronal,,,,ambivalente
Cursos para el área de Capacitación y Formación,,Charlas/Capacitaciones,,,,
Dan Asesoría en Guayaquil y Quito? En dónde están ubicados en GYE?,,Contacto,,,,
dan capacitaciones?,,Charlas/Capacitaciones,,,,
Dan consultorias en asesoria financiera?,,Otros servicios,,,,
Dan el servicio de Capacitaciones presenciales? ,,Charlas/Capacitaciones,,,,
"Daniela, por favor ayudeme, estoy pidiendo asistencia para calculo de jubilaciones de OG DISTRIBUCIONES 
Pero al mail que envie no me ha llegado nada",,Jubilacion Patronal,empresa,NP,,
datos para la factura,,Facturacion/Retencion/Cobros,,,,
"David Subia R de plan auto CONECA le saluda, por favor quisiera saber si ustedes realizan evaluaciones 360",,Consultoria,,,,
"De los cuatros seguros manejados por la Seguridad Social, no cabe duda
que el Seguro de Invalidez, Vejez y Muerte y el de Salud, agrupa las prestaciones que representan la mayor concentración de recursos en el sistema y el mayor desafío colectivo",,IESS,,,,
DE QUE SE TRATA O QUE ES,,No Topic,,,,
deceo saber si puedo jubilarme com 68 inposiciones buenas tardes,,IESS,,,,
Deseo el cálculo por desausio,,Renuncia/Despido/Desahucio,,,,
Deseo hacer una consulta si me lo permite,,No Topic,,,,
Deseo Jubilarme soy empleado publico y cumplo los requisitos para jubilarme deseo saber si tengo derecho a recibir el bono  por jubilación de los 5 salarios mínimo por año de servicio pertenezco al código del trabajo y soy empleado público,,IESS,,,,
"DESPEJEME UNA DUDA 
MI NOMBRE ES JOE HIDALGO ",,No Topic,,,,
Desvinculación Laboral Voluntaria,,Renuncia/Despido/Desahucio,,,,
Detección de fraude y alertas tempranas,,Consultoria,,,,
"Diagnóstico de clima laboral, permite medir las sensaciones de bienestar o de eventual malestar que experimentan los colaboradores",,Consultoria,,,,
Dirección en guayaquil,,Contacto,,,,
Disculpa buenas tardes cuanto me cuentas el calculo de una jubilacion patronal por servicio domestico por 24 años de servicio,,Jubilacion Patronal,persona,0,,
Disculpa tengo que pagar una factura quería saber si podremos pagar por medio de transferencia,,Facturacion/Retencion/Cobros,,,,
Disculpa tengo que pagar una factura quería saber si podremos pagar por medio de transferencia ,,Facturacion/Retencion/Cobros,,,,
"disculpe a mi me llamaron
de este numero
2959505",,No Topic,,,,
disculpe cunto me cuesta un estudio actuaría para el 2019,,Jubilacion Patronal,,,,
"Disculpe me comunico de parte de Fundacion Fabian Jaramillo Davila, mi nombre es Valeria Garcia, le comento que debemos realizar un pago pero deseo confirmar el porcentaje de retención y el codigo el debemos realizar a su factura? me comunique telefonicamente pero no me contestaron. Gracias",,Facturacion/Retencion/Cobros,,,,
disculpe me podria asesorar para realizar un tramite de jubilacion del iess por favor,,IESS,,,,
"disculpe  me gustaria hacer una consulta para saber si puedo proceder a buscar ayuda.mi esposa   quedo embarazada   en periodo de carencia,.y la  compañia  solo quiere pagar las consultas  con el medico  a partir  del 5tomes. imponiendo ellos el medico",,Consultoria,persona,,,
"Disculpen
mi Nombre es Miguel Barrera
yo hacia antes los estudios actuariales con uds",,Jubilacion Patronal,,,,
Diseño e implementación de sistemas presupuestarios para el control de márgenes de utilidad de empresas o proyectos. ,,Otros servicios,,,,
Donde queda ACTUARIA?,,Contacto,persona,,,
Donde queda esta consultoria,,Contacto,,,,
Donde queda su oficina? La que es en quito,,Contacto,,,,
donde son sus oficinas?,,Contacto,,,,
DOS PALABRAS,,No Topic,,,,
"Ejemplo de Cuentos. El cuento es definido como una narración breve creada por uno o varios autores, basada en hechos reales o ficticios, cuya trama es protagonizada por un grupo reducido de personajes y con un argumento relativamente sencillos.",,No Topic,,,,
"El 13 de noviembre de 2015, el Consejo Directivo del IESS, mediante Resolución No. CD 501, estableció una reducción temporal en los aportes al Fondo de Pensiones del 9,74% al 5,86% y
un incremento en el aporte para salud del 5,71% al 9,94%. ",,IESS,,,,
"El 18 de noviembre de 2010 mediante Registro Oficial No. 323, se
publicó la reforma a la Ley de Seguridad Social, que en su artículo 5 establece que las pensiones de invalidez, vejez, incapacidad
permanente parcial, incapacidad permanente total e incapacidad
permanente absoluta, de riesgos del trabajo del IESS se incrementarán anualmente a partir del mes de enero de cada año, en base a
un coeficiente de crecimiento",,IESS,,,,
"El afiliado o afiliada que reúnen los requisitos exigidos por el IESS, tienen derecho a pensiones mensuales vitalicias, la mismas que se pagan a partir del primer día del mes siguiente al que el asegurado (a) cesó en el o los empleos. ",,IESS,,,,
El día De hoy me indicaron que las aportaciones para jubilarse subió no es 30 sino 40 años de aportación es correcto o no,,IESS,,,,ambivalente
El día De hoy me indicaron que las aportaciones para jubilarse subió no es 30 sino 40 años de aportación es correcto o no,,Jubilacion Patronal,,,,ambivalente
El IESS debe ser administrado por los jubilados.,,IESS,,,,
"El peor servicio ... Nos robaron dinero , cuando les mostramos que estaban equivocados, pero no nos pidieron disculpas ni reembolso nosotros ...
Todos los consejos que nos dieron  estaban mal ... ",,Queja,,,,
"el servicio eS terrible, comunicarse con ustedes fue imposible y su precio es muy caro",,Queja,,,,
"El simulacro de cálculo de pensión en la página del iess jubilación ordinaria de vejez es válida o no? Y si mis sueldos aportados durante diez años han sido el mismo 1680.20 cuál sería el valor de mi pensión con 60 años y 35 años de aportes, según el iess bajo la nueva fórmula sería siliar al cálculo anterior.",,IESS,,,,
"empezamos a contratar trabajadores desde el 2017
necesito saber si estoy obligado a realizar el estudio actuarial",,Jubilacion Patronal,,,,
en cuanto tiempo me entregan mi estudio actuarial?,,Jubilacion Patronal,,,,
EN EL CASO DE UNA PERSONA QUE LABORÓ 27 AÑOS EN RELACIÓN DE DEPENDENCIA Y LUEGO REALIZA APORTES VOLUNTARIOS SOBRE EL SUELDO BÁSICO; LE SERÍA DE UTILIDAD INCREMENTAR EL SUELDO A $1.000 (DURANTE ESTOS 3 ÚLTIMOS AÑOS QUE LE FALTAN PARA JUBILARSE DEL IESS) PARA PODER RECIBIR UN VALOR MÁS ALTO POR JUBILACIÓN.,,IESS,,,,
"En el IESS me dicen que llegue a las 180 imposiciones para obtener mas beneficio de pension
Que me recomienda?",,IESS,,,,
"En este contexto, el capital humano se refiere a las ventajas económicas que los empleados traen a una empresa en virtud de las de formación, experiencia y habilidades que poseen. La mayoría de las empresas buscan los servicios de una empresa de consultoría de recursos humanos en algún momento con el fin de ayudarles a darse cuenta de las ventajas competitivas que se pueden obtener mediante el aumento de su capital humano",,Consultoria,,,,
en la informacion habla sobre el grafico estadistico de los 10 preimeros seguros y no lo veo dnd lo podria cnseguir,,Consultoria,,,,
En qué casos y a quienes puede afectar dicho cálculo que es la media geométrica ? oriéntenme un poco /gracias …!!!,,IESS,,,,
En que consiste el Bussines Intelligence?,,Consultoria,,,,
En que consiste la Bonificación por Desahucio y Despido Intempestivo?,,Renuncia/Despido/Desahucio,,,,
En que consiste su producto de evaluacion 360?,,Consultoria,,,,
"en que forma, pregunto porque ando interesada en hacer facturacion por internet",,Facturacion/Retencion/Cobros,,,,
"En representación de la empresa INTUITO S.A se extiende el presente informativo para brindar el servicio de Sistema de Facturación Electrónica de acuerdo a los requerimientos del SRI:

Principales Beneficios del Sistema de Facturación Electrónica de Intuito S.A.

Genera los 5 comprobantes electrónicos: Factura, Comprobante de Retención, Nota de Crédito, Nota de Débito y Guía de Remisión.
Cada uno de los servicios incluye mantenimiento de documentos tributarios electrónicos.
Proceso de firmado, encriptar y enviar los documentos al SRI para su respectiva validación u autorización.
Portal Web de descarga de XML y PDF para administrador y clientes.
Envío automático por correo de XML y PDF al cliente o proveedor.
Soporta Multiempresa.
Generación de reportes en Excel.
Multiestablecimiento.
Visualización previa de RIDE o PDF
Integración ERP(costo adicional).
Sistema facturador facil de usar, accede a un video:",,Facturacion/Retencion/Cobros,,,,
en su pagina indica áreas de Capacitación y dice Seguros a que se refiere?,,Charlas/Capacitaciones,,,,
"En uno de los enclaves ya clásicos para el disfrute de los deportes y actividades en contacto con la naturaleza, la vertiente oriental del Parque Nacional de Ordesa, se ubica este acogedor refugio de montaña. El aire puro de los Pirineos y del Monte Perdido, las limpias aguas del río Cinca o la tradición presente en la iglesia románica de Nuestra Señora de la Pineta, propician una cálida sensación de bienestar, paz y tranquilidad. Todas las habitaciones poseen hermosas vistas de este bello enclave natural. De la cocina del comedor Alto Aragón resultan sencillos pero sabrosos platos: migas aragonesas, trucha del Cinca a lo fino, cordero asado, chuletas de cerdo o postres típicos de la región.",,No Topic,,,,
entregan,,No Topic,,,,
Enviaremos la cotización,,No Topic,,,,
Envío mi cv para una oportunidad laboral,,trabaje con nosotros,,,,
"es conveniente el cálculo actuarial desde los inicios de la actividad de la empresa, o se lo debe hacer después de que tiempo?.
es para todos los trabajadores o es necesario un número de años de servicios para el respectivo cálculo?",,Jubilacion Patronal,,,,
es en quito,,No Topic,,,,
Es lo mismo el desahucio que el despido intempestivo?,,Renuncia/Despido/Desahucio,,,,
es posible adquirir este beneficio de hipoteca inversa hoy en día en Ecuador?,,Consultoria,,,,
Es verdad lo que comenta sobre la jubilación con carnet de discspacidad?,,IESS,,,,
Espantoso el servicio del personal,,Queja,,,,
"espero me puedan ayudar con esta informacion.de ante mano muchas gracias
cuales son las ventajas y desventajas del cálculo de la media geométrica y aritmética en el cálculo realizado en el IESS.",,IESS,,,,
estado de resultados,,Otros servicios,,,,
Estan al tanto de lo nuevo en Data Science?,,Consultoria,,,,
"Estan buscando perfiles, donde puedo enviar mi cv?",,trabaje con nosotros,,,,
Estan contratando?,,trabaje con nosotros,,,,
estan en Quito uds ??,,Contacto,,,,
estaré esperando el,,No Topic,,,,
estilo,,No Topic,,,,
"Estimada Andre,

He revisado las notas técnicas, las tarifas del plan Black no son las mismas que nos habías pasado en esta semana a que se debe este cambio?? 

Saludos cordiales, ",,Consultoria,,,,
Estimada buenas tardes pregunta a que se refiere con provisiones futuras dentro de un estudio actuarial y eso debe ser contabilizado,,Jubilacion Patronal,empresa,0,,
Estimada Daniela. Mi consulta va en este sentido al momento me falta 4 años para jubilarme si mejoro mi aporte mejora mi pension queria saber que valor se paga de aporte si lo hago sobre sueldo de 500 dólares. Gracias de antemano.,,IESS,,,,
"Estimada Domenica, una consulta estoy revisando el cuestionario pero  en relación a la información que se solicita se entregue por ramos  de seguros, no podríamos aplicar ya que solo se tiene medicina prepagada en este caso el detalle es unicamente sobre este concepto o hay que bajar no se talvez a nivel de producto.(corporativo, individual, etc).
",,Consultoria,,,,
Estimada: cual es el calculo de para saber el valor del montepio de una persona de 50 años aportando de manera voluntaria por 1500 mesnuales,,IESS,,,,
"Estimado Mario,

 

Por favor tu ayuda desarrollando las Notas Técnicas para los nuevos Planes Empresariales.

 

Para ello adjunto las matrices de coberturas y es importante considerar que se le incluirá el beneficio de Seguro de Vida de Muerte por cualquier causa al Titular del núcleo.

 

Agradezco de antemano tu atención.",,Consultoria,,,,
"Estimados Actuaria buenas tardes
su ayuda por favor",,Greeting,,,,
ESTIMADOS BUENAS TADER TARDES,,Greeting,,,,
"Estimados buenas tardes
necesito una cotización para estudio actorial",,Jubilacion Patronal,,,,
"Estimados Buenas tardes, le saluda Karina Cifuentes de Jassatelecom, a traves del presente solicito su ayuda en la cotizacion de un calculo Actuarial.
en espera de sus comentarios
saludos cordiales.",,Jubilacion Patronal,,,,
Estimados buenos dias somos clientes de Actuaria(Magnolia RUC 0992876905001 y nos están consultando uds qué tasa aplicar para el estudio actuarial ya que somo NIIF Full Por favor ayúdeme indicando el numero de resolucion de la SUPERCIAS que aclaró este tema para proceder a responderle,,Jubilacion Patronal,empresa,0,,
Estimados este cambio a la tasa aplica en el informe de actuaria que nos emitieron correspondiente al 2016.?,,Jubilacion Patronal,,,,
Estimados muy buenos días aproximadamente hace un mes estuve en un desayuno acerca de la situación del Iess y la afiliación de los representantes legales,,IESS,,,,
"Estimados Señores Actuaria reciban un cordial saludo, para el calculo del fondo global o fondo vitalicio de un Colaborador que tiene 33 años de trabajos y esta solicitando Jubilacion Patronal;es indispensable realizar el calculo a traves de la Actuaria.Su edad actual es 64 años.
Espero sus comentarios.
Gracias.",,Jubilacion Patronal,,,,
ESTIMADOS UN INFORME ACTUARIAL CADA CUANTOS AÑOS SE LO REALIZA,,Jubilacion Patronal,empresa,0,,
"estimados
necesito una cotizacion de serv de consultoria actuarial
mariuximoran1",,Jubilacion Patronal,,,,
"Estimados, mi papá tiene 63 años y 3 años de aportación por afiliación voluntaria, se podrá Jubilar al IESS a los 65 años con 5 años de aportación?.",,IESS,,,,
"Estimados, porfa cambien el texto de condiciones sanitarias y el clausulado para las notas técnicas individuales.

 

En cuanto al anexo de tarifa cero, únicamente se debe reemplazar el titular por ""Anexo Tarifa 0 (Cero) (Prestaciones de prevención primaria)

 ",,Consultoria,,,,
"Estimados, Quiero saber mas sobre el servicio de valoracion actuarial, y sus costos",,Jubilacion Patronal,empresa,0,,
"Estimados, respecto al comunicado de la supercias concluye que Ecuador cuenta con un mercado de bonos corporativos de alta calidad, cuyas características se pueden asociar a un mercado amplio. Respecto a los estudios actuariales 2017 se considerará los bonos locales y con efecto retroactivo?",,Jubilacion Patronal,,,,
Estoy bien,,Hi Five,,,,
"estoy llamando a sus numeros en guayaquil 
pero no me responden 
con quien puedo conversar",,Contacto,,,,
estructura organizacional,,Otros servicios,,,,
"Estudiar clima laboral de nuestra organización o empresa sera favorable pues tendrá efectos positivos en las actitudes dirigidas al trabajo, así como su desenvolvimiento con los demás y sus tareas de su respectiva área laboral del personal. Esto hará que se fortalezca la empresa internamente y logrando mejorar para los clientes externos. Introducir un software que registre datos de las necesidades de empelados y su clima, resumirá tiempos y optimizara resultados que nos mencionen que áreas y que circunstancias debemos atender.",,Consultoria,,,,
estudio,,No Topic,,,,
estudio de ,,No Topic,,,,
estudios de es ,,No Topic,,,,
Estudios de factibilidad financiera para garantizar la sostenibilidad empresarial en el largo plazo.,,Otros servicios,,,,
Evaluación 360,,Consultoria,,,,
Evaluación de Estado de Resultados e Indicadores,,Otros servicios,,,,
"excelente 
gracias me despido ",,Hi Five,,,,
Excelente apoyo,,Hi Five,,PP,,
excelente gestión,,Hi Five,,,,
Excelente página ..,,Hi Five,,,,
Excelente tarde,,Hi Five,,,,
"excelente
gracias me despido",,Hi Five,,,,
"Excelente, Gracias",,Hi Five,,,,
existen seguros para mi perro,,Consultoria,,,,
EXITOS Y BENDICIONES.....!!!.,,Hi Five,,,,
FAVOR ENVIAR COTIZACION PARA ESTUDIO ACTUARIAL DE LA EMPRESA ENVATUB S.A RUC 1792332583001 APROX 42 PERSONAS....correo: diefer1710@hotmail.com     Gracias,,Jubilacion Patronal,,,,
favor su ayuda con un correo electronico,,Contacto,,,,
Felicitaciones por el servicio en línea que prestan.,,Hi Five,,,,
Felicitaciones por este servicio on-line.,,Hi Five,,,,
felicitaciones sigan adelante,,Hi Five,,,,
Felicitaciones srs actuaria por su buen servicio,,Hi Five,,,,
felicitaciones!!,,Hi Five,,,,
"Gabriela trabaja en una tienda de ropa. Ella ama su trabajo porque le gusta la moda y disfruta recomendar a los clientes la ropa más adecuada según sus gustos y necesidades.

Por la mañana, una cliente le pide ayuda para elegir ropa formal para una entrevista de trabajo. Gabriela le recomienda una camisa blanca y una falda gris, con unos zapatos que combinan con su bolso. El cielo está nublado, así que lleva un paraguas por si acaso.

Más tarde, otra cliente pide ayuda para elegir el mejor regalo para su novio. Gabriela le muestra unas corbatas muy bonitas, un elegante reloj y unas modernas gafas de sol. Ella se decide por una corbata a rayas rojo y azul.

Un cliente va a comprar ropa para sus vacaciones en la playa. Elije unos pantalones cortos, un sombrero para protegerse del sol y una camisa de algodón.

Poco antes de cerrar la tienda, llega un hombre muy apurado porque debe hacer un viaje a Finlandia y no tiene ropa abrigada. Gabriela le sugiere que lleve unas botas, una bufanda para cubrir su cara y una gruesa chaqueta. Asi es, Gabriela ama su trabajo",,No Topic,,,,
generador de electricidad,,No Topic,,,,
gestion financiera,,Otros servicios,,,,
ggarofalo@cargoline.ec gardenia garofalo de la empresa Cargoline del Ecuador S.A. ..Por favor indicarme el costo por la estimación actuarial JUBILACION Y DESAHUCIO de 4 empleados.,,Jubilacion Patronal,empresa,0,,ambivalente
ggarofalo@cargoline.ec gardenia garofalo de la empresa Cargoline del Ecuador S.A. ..Por favor indicarme el costo por la estimación actuarial JUBILACION Y DESAHUCIO de 4 empleados.,,Renuncia/Despido/Desahucio,persona,0,,ambivalente
gracais,,No Topic,,,,
gracias,,Hi Five,,,,
"Gracias 
Un excelente día",,Hi Five,,,,
Gracias Actuaria por su fiel compromiso de apoyo a nuestros niños en Fundación Caminitos de Luz,,Hi Five,,,,
gracias por ayudarme,,Hi Five,,,,
Gracias por despejar algúnas interrogantes,,Hi Five,,,,
Gracias por esta tan valiosa aportacion,,Hi Five,,,,
"Gracias por esta tan valiosa aportacion, me gusto en analisis, es claro que exite un fundamento para llegar a estas conclusiones, me han hecho reflexionar un poco mas en ellos y creo que aun hay algunas cosas que hacer al respecto en mi organización. Me parece que la medicion de clima laboral es muy util para las empresas y organizaciones para generar planes de mejora en sus procesos internos.",,Consultoria,,,,
gracias por la aclaración,,Hi Five,,,,
Gracias por mantener contacto en línea. Felicitaciones por este servicio.,,Hi Five,,,,
gracias por responder mi consulta,,Hi Five,,,,
gracias por ser tan buenos,,Hi Five,,,,
Gracias por su atención y servicio,,Hi Five,,,,
gracias por su tiempo,,Hi Five,,,,
Gracias requiero el valor de una acta de finiquito por favor,,Renuncia/Despido/Desahucio,persona,0,,
gran trabajo,,Hi Five,,,,
grande y fuerte,,No Topic,,,,
grasa y destape,,No Topic,,,,
"Gusto en saludarte, por medio del presente solicito de tu buena gestión en poder actualizar el condicionado adjunto, en la NT de Asistencia Médica, ya que recibimos solicitud de correcciones por parte del ACESS y estas ya fueron realizadas.",,Consultoria,,,,
hace mas de 2 semanas solicite una cotizacion para otra empresa que manejo me indicaron que alguien se contactaria conmigo via pero hasta la fecha lo hacen sería tan amable de indicarme si mi requerimiento será atendido??,,Queja,,NP,,
Han trabajado con Modelos de Deserción Cliente en ACTUARIA?,,Consultoria,,,,
Han trabajado en la NIC 12 – Impuestos Diferidos?,,Jubilacion Patronal,,,,
Han trabajado en viabilidad de proyectos?,,Otros servicios,,,,
Hay posiciones abiertas en ACTUARIA?,,trabaje con nosotros,,,,
"he enviado un correo a info@actuaria.com.ec y por este medio, para que me ayuden con una cotizacion para un informe actuarial del 2018 no he recibido respuesta me puede ayudar por este medio? 
mi correo es alvaro.aldas@imetel.com.ec somos 63 trabajadores",,Jubilacion Patronal,empresa,NP,,
"he enviado un correo a info@actuaria.com.ec y por este medio, para que me ayuden con una cotizacion para un informe actuarial del 2018
no he recibido respuesta
me puede ayudar por este medio?
mi correo es alvaro.aldas@imetel.com.ec
somos 63 trabajadores",,Jubilacion Patronal,,,,
herramienta de indicadores,,Otros servicios,,,,
"Herramienta de indicadores para la toma decisiones gerenciales en cuanto a cartera, ventas, gastos, rentabilidad, productividad, entre otros.",,Otros servicios,,,,
hola,,Greeting,,0,,
Hola,,Greeting,,,,
HOLA  NECESITO SABER CUANTO SE HACE DE RETENCION A UDS.,,Facturacion/Retencion/Cobros,,,,
"HOLA 
BUEN DIA UNA CONSULTA",,Greeting,,,,
Hola !,,Greeting,,,,
Hola ayudenme como calculo el despido ineficaz de un persona embarazada y una persona con discapacida    porfavor,,Renuncia/Despido/Desahucio,persona,0,,
HOLA BUEN DIA,,Greeting,,,,
HOLA BUEN DÍA ME AYUDARÍA CON UN CORREO ELECTRÓNICO PARA GENERA LA RETENCIÓN,,Contacto,,,,
Hola buenas tarde,,Greeting,,,,
Hola buenas tarde! Ustedes ofrecen training outdoor?,,Greeting,,,,
hola buenas tardes,,Greeting,,,,
"Hola buenas tardes Daniela, soy Saúl y me gustaría saber si ofrecen determinados servicios de modelado estadístico al respecto, muchas gracias de antemano",,Consultoria,,,,
HOLA BUENAS TARDES RECIBI SU COTIZACION Y EL FORMATO  YA LO TENGO LLENO PERO NO  SE CUAL ES EL VALOR QUE SE DEBE PAGAR POR EL ESTUDIO ACTUARIAL DE NUESTRA EMPRESA  SI ES POR PERSONA  EXPLIQUEME POR FAVOR,,Jubilacion Patronal,,,,
Hola Buenas tardes somos un grupo de jubilados que trabajamos en el iess. No nos están pagando lo que se debería  estamos peleando 4 años y nadie responde. Siempre hay algún pretexto para no pagarnos. Éramos del código de trabajo hay leyes y documentos q respaldan aquello pero no nos hacen caso,,IESS,persona,0,,
HOLA BUENAS TARDES TENGO QUE PAGARLES A Y NO TENGO EL NUMERO DE CUENTA ME AYUDAN POR FAVOR,,Facturacion/Retencion/Cobros,,,,
"hola buenas tardes! 
me puede confirmar el correo para envio de facturas electronicas?",,Contacto,,,,ambivalente
"hola buenas tardes! 
me puede confirmar el correo para envio de facturas electronicas? ",,Facturacion/Retencion/Cobros,,,,ambivalente
"Hola buenas tardes, tengo 20 años trabajando en una empresa privada, se ellos me votan. Cuanto recibiré? Por el despido",,Renuncia/Despido/Desahucio,,,,
"hola buenas tardes. podria indicarme sobre el curso de gestion financiera. gracias 
costo, horario",,Otros servicios,,,,ambivalente
"hola buenas tardes. podria indicarme sobre el curso de gestion financiera. gracias 
costo, horario",,Charlas/Capacitaciones,,,,ambivalente
hola buenastardes,,Greeting,,0,,
Hola buenos dias,,Greeting,,,,
Hola buenos días como calcular un finiquito,,Renuncia/Despido/Desahucio,,,,
Hola buenos días como calcular un finiqyito,,Renuncia/Despido/Desahucio,,,,
HOLA BUENOS DIAS LE ESTOY ENVIANDO EL DEPOSITO DEL ESTUDIO ACTUARIAL Y LA RETENCION  I R  DE e CIA LTDA RUC r,,Facturacion/Retencion/Cobros,,,,
Hola buenos dias lo q pasa esq necesiti ayuda,,Greeting,,,,
Hola buenos días me podrían dar información sobre el la renuncia x desahucio,,Renuncia/Despido/Desahucio,,,,
hola buenos dias mi papa fallecio ya era jubilado el pertenecia al magisterio pero compañeros de el comentaban que firmaron un documento donde si fallecieran les hacian una liquidacion en sesantia no estoy claro si me pueden ayudar respondiendome.,,Renuncia/Despido/Desahucio,,,,
Hola buenos días pueden hacer algún tipo de descuentos ilegales en la liquidación,,Renuncia/Despido/Desahucio,persona,0,,
Hola buenos días una pregunta por despido intempestivo por 8 años de trabajo con el sueldo básico. Cuanto debería resivir de liquidación....,,Renuncia/Despido/Desahucio,persona,0,,
"Hola Buenos Dias
Su ayuda con requisitos y precio para realizar el estudio",,Greeting,,,,
"hola buenos días, Soy Ruth Jaramillo de Textiles Mar y Sol S.A.",,Greeting,empresa,,,
Hola como esta buen dia cuando me puedo jubilar me puede ayudar,,IESS,,,,ambivalente
Hola como esta buen dia cuando me puedo jubilar me puede ayudar,,Jubilacion Patronal,,,,ambivalente
Hola como puedo elaborar mi desahucio,,Renuncia/Despido/Desahucio,,,,
HOLA CUAL SERIA EL VALOR A CANCELARME POR EL TIEMPO DE SERVICIO TRABAJE CINCO AÑOS EL ULTIMO SALARIO ERA DE 375,,Renuncia/Despido/Desahucio,persona,0,,
Hola necesito hacerles una consulta y saber si pueden ayudarme por correo y yo pagaría vía transferencia?,,Contacto,,,,ambivalente
Hola necesito hacerles una consulta y saber si pueden ayudarme por correo y yo pagaría vía transferencia?,,Facturacion/Retencion/Cobros,,,,ambivalente
"Hola Daniela, buenos días. Te escribo desde México, mira, estoy llevando a cabo una investigación sobre que requisitos necesita un actuario para registrar un producto de seguros. No sé si podrías ayudarme a guiarme un poco 
",,Consultoria,persona,0,,
hola donde puedo descargarme las facturas electronicas?,,Facturacion/Retencion/Cobros,,,,
Hola estimada buen dia,,Greeting,,,,
