Pregunta,respuesta,Tema,Pers/empresa,Polarity,Nota,ambiguedad
"Para la jubilación de el IESS, si se aporta por dos empresas a la vez , eso cuenta como dos imposiciones , es decir al año 24 o solo 12?",,IESS,,,,
"Para la jubilación patronal, si se aporta por dos empresas a la vez , eso cuenta como dos imposiciones , es decir al año 24 o solo 12?",,Jubilacion Patronal,,,,
"Para la jubilación, si se aporta por dos empresas a la vez , eso cuenta como dos imposiciones , es decir al año 24 o solo 12?",,Jubilacion Patronal,,,,ambivalente
"Para la jubilación, si se aporta por dos empresas a la vez , eso cuenta como dos imposiciones , es decir al año 24 o solo 12?",,IESS,,,,ambivalente
para que se hace esto,,No Topic,,,,
Para una jubilacion exigen...65 años de edad y 30 o 35 de aportes.,,IESS,,,,ambivalente
Para una jubilacion exigen...65 años de edad y 30 o 35 de aportes.,,Jubilacion Patronal,,,,ambivalente
Percibo pensiones de jubilacion ordinaria de vejez y patronal normalmente. Pero en Diciembre del 2016 no se me pago el decimo tercero de la patronal. En razon de esto solicito dicho pago.,,Jubilacion Patronal,,,,ambivalente
Percibo pensiones de jubilacion ordinaria de vejez y patronal normalmente. Pero en Diciembre del 2016 no se me pago el decimo tercero de la patronal. En razon de esto solicito dicho pago.,,IESS,,,,ambivalente
peritos evaluadores,,Otros servicios,,,,
"Pero ya era demasiado tarde. Manu recorría la ciudad insultado a todos solo para ver cómo sus palabras tomaban forma y sus letras se lanzaban contra quien fuera como fantasmas que, al tocarlos, los atravesaban y los transformaban en aquello que hubiera dicho Manu. ",,No Topic,,,,
perro,,No Topic,,,,
persona,,No Topic,,,,
"pesimo servicio, estoy esperando el estudio por mas de 22 dias",,Queja,persona,NP,,
Pésimo trato del personal,,Queja,,,,
Plan de Ahorro y Retiro PAR,,Renuncia/Despido/Desahucio,,,,
"Podemos decir que la parte más importante de una inteligencia artificial es la capacidad de aprender, de cambiar su comportamiento en base a nueva información.",,Consultoria,,,,
Podria explicarme en que consiste la evaluacion 360?,,Consultoria,,,,
"podria explicarme un poquito para poder indicarles bajo que modalidad trabajaremos Buenos días, necesito me confirme la tasa de descuento con la que se desea trabajar: Bonos corporativos de alta calidad de los Estados Unidos (tasa aproximada del 4.25%) Bonos corporativos de alta calidad del Ecuador (tasa aproximada del 7.72%) este es para te del mail que Danile le pasa a mi compañera Lorena podria por favor indicarme a que hace referencia este tema o donde puedo encontrar la base legal sobre esto...??",,Jubilacion Patronal,empresa,0,,
por favor cuanto cuesta sus servicios,,No Topic,,,,
"POR FAVOR DRA. DANIELA, SOY DOCENTE CON 30 AÑOS DE SERVICIO Y 360 IMPOSICIONES ESTOY EN PROCESO DE JUBILACION POR INVALIDEZ Y MI INQUIETUD ES LA SIGUIENTE: SI RECIBIRE EL BONO DEL ESTADO ECUATORIANO Y CUANTO SERA EL MONTO APROXIMADO, DEL IESS NO SE QUE TENGO QUE CUMPLIR 60 DE EDAD Y 30 AÑOS DE SERVICIO PARA QUE ME DEN LA MENSUALIDAD. MUCHAS GRACIAS POR SU RESPUESTA ",,IESS,,,,
"Por favor en el mes de marzo del 2018 cumplo 60 años y tendría 37 años y medio de aportes., podría ya jubilarme? Graicas",,Jubilacion Patronal,,,,ambivalente
"Por favor en el mes de marzo del 2018 cumplo 60 años y tendría 37 años y medio de aportes., podría ya jubilarme? Graicas",,IESS,,,,ambivalente
"Por favor es tan amable, necesito saber si me pueden ayuda con una cotizacion para la realizacion de un estudio actuarial del 2017 y del 2018",,Jubilacion Patronal,empresa,0,,
"Por favor indicar si existe un valor máximo a percibir como jubilación patronal en la Empresa Eléctrica Quito, ya que me jubilé en diciembre del 2018 y en un documento constaba una pensión mensual de 1.300 pero actualmente me están cancelando 380 gracias",,Jubilacion Patronal,,,,
Por favor me ayuda con informacion de las capacitaciones de seguros?,,Charlas/Capacitaciones,,,,
"POR FAVOR ME FALTA 10 MESES PARA CUMPLIR 30 AÑOS DE APORTACION Y TENER 60 AÑOS, TRABAJE EN RELACION DE DEPENDENCIA 27 AÑOS Y SIGO APORTANDO VOLUNTARIAMENTE CON EL BASICO
LOS CINCO MEJORES AÑOS APORTE SOBRE 2500
CUANTO TENDRIA QUE PERCIBIR DE PENSION JUBILAR DEL IESS",,IESS,,,,
"Por favor me informa si un pensionado que vive en el exterior y muere allá, tiene derecho a gastos funerarios?",,IESS,,,,
Por favor me podria indicar ...con 400 aportaciones seguidas en el Instituto del seguro socil ....65 años de edad ....claro ya estoy dentro de los requisitos que pide esta institución....pero para la juvilacion patronal dicen son 25 ...yo solo tengo 22 ...me liquidaran con una parte proporcional....favor expliqueme este caso.,,IESS,,,,ambivalente
Por favor me podria indicar ...con 400 aportaciones seguidas en el Instituto del seguro socil ....65 años de edad ....claro ya estoy dentro de los requisitos que pide esta institución....pero para la juvilacion patronal dicen son 25 ...yo solo tengo 22 ...me liquidaran con una parte proporcional....favor expliqueme este caso.,,Jubilacion Patronal,,,,ambivalente
por favor necesito me ayude con la informacion del cuanto serian los costos por una calculo de jubilacion patronal,,Jubilacion Patronal,,,,
POR FAVOR NECESITO SABER  QUE TRAMITES TENGO QUE HACER PARA JUBILARME POR  PROBLEMAS PSQUIATRICOS  TENGO  18 AÑOS DE SERVICIO EN EL MSP,,IESS,,,,
"Por favor necesito saber todo sobre las capacitaciones sobre seguros
temarios
horarios, direccion y costos
me ayudan con esa información por favor mi correo es veronica.jacome@metricbank.com",,Charlas/Capacitaciones,,,,
Por favor necesito su ayuda:,,No Topic,,,,
por favor quiero consultarles es necesario realizar el estudio actuarial si manejo solo una empelada para una compañia ?,,Jubilacion Patronal,empresa,0,,
por favor requiero cotizacion de sus servicios,,No Topic,,,,
"por favor su ayuda, con un correo electrónico para poderles enviar una retención electrónica. Gracias. ",,Contacto,,,,
"Por favor, a qué telefono le llamo para solicitar cotizacion del estudio actuarial?",,Contacto,,,,ambivalente
"Por favor, a qué telefono le llamo para solicitar cotizacion del estudio actuarial?",,Jubilacion Patronal,empresa,0,,ambivalente
por si acaso yo acabo,,No Topic,,,,
por su atencion gracias,,Hi Five,,,,
Porque no contestan el telefono? Es muy dificil contactarse con ustedes,,Queja,,NP,,
porque se demoran tanto y hacen mal sus estudios,,Queja,,,,
pregunta,,No Topic,,,,
pregunta Dan capacitaciones,,Charlas/Capacitaciones,,,,
PRODUCTORA M  YA RECIBIO LA FACTURA DEL ESTUDIO ACTUARIAL TENGO QUE HACER UN DEPOSITO SEGUN LA FACTURA  EMITIDA POR UDS. PERO QUIERO SABER CUANTO ES LA RETENCION QUE HAY Q HACER  GRACIAS,,Facturacion/Retencion/Cobros,,,,
"Proyección de beneficios (millas, redención de puntos, entre otros)",,Consultoria,,,,
"proyectos que tienen que ver con materias tan delicadas como discutibles, tales como la gestión del compromiso, la mejora de la comunicación interna, los planes para fomentar la motivación o la involucración del personal, las medidas de fomento de la marca interna o de impulsión de la marca empleadora",,Consultoria,,,,
"proyectos relativos al fortalecimiento de una cultura de empresa o las acciones de aseguramiento en procesos de gestión del cambio y muchos otros que tienen que ver con los planes de capacitación o de formación,",,Consultoria,,,,ambivalente
"proyectos relativos al fortalecimiento de una cultura de empresa o las acciones de aseguramiento en procesos de gestión del cambio y muchos otros que tienen que ver con los planes de capacitación o de formación,",,Charlas/Capacitaciones,,,,ambivalente
Pueden ajudarme para tramitar mi juvilacion? Gracias.,,IESS,persona,0,,ambivalente
Pueden ajudarme para tramitar mi juvilacion? Gracias.,,Jubilacion Patronal,persona,0,,ambivalente
"Pueden ayudarme tengo una consulta,
el próximo mes de octubre cumplo 60 años y tengo 37 años de aportes, en el mes de noviembre ya podría tramitar mi jubilación??
gracias de antemano",,IESS,,,,ambivalente
"Pueden ayudarme tengo una consulta,
el próximo mes de octubre cumplo 60 años y tengo 37 años de aportes, en el mes de noviembre ya podría tramitar mi jubilación??
gracias de antemano",,Jubilacion Patronal,,,,ambivalente
puedo entonces recibir dos jubilaciones del empleador y del Iess,,IESS,,,,ambivalente
puedo entonces recibir dos jubilaciones del empleador y del Iess,,Jubilacion Patronal,,,,ambivalente
Puedo enviar mi curriculum vitae?,,trabaje con nosotros,,,,
Puedo enviar mi cv para ser considerado para un trabajo?,,trabaje con nosotros,,,,
puedo formar parte de su equipo?,,trabaje con nosotros,,,,
"Que compañías están obligadas a contratar estudio actuarial, cuales son los requisitos que deben cumplir.",,Jubilacion Patronal,,,,
que es actuaria,,No Topic,,,"por lo pronto se pone como no topic, podria ser para nuevo topic",
Qué hace Actuaria?,,Contacto,persona,,,
Que incluye sala de velacion y boveda?,,IESS,,,,
Que mal me ha ido trabajando con ustedes,,Queja,,,,
"Que mal trabajo hacen ustedes, muy malo",,Queja,,,,
que necesito yo,,No Topic,,,,
Que ocurre en la terminación de la relación laboral?,,Renuncia/Despido/Desahucio,,,,
Que pasaría si una persona tiene menos de 60 aportaciones para jubilarse,,IESS,,,,
Que productos venden en consultoría?,,Consultoria,empresa,,,
"Que tal deseo saber si estando afiliado ya en una compañia, me puedo afiliar voluntariamente para jubilarse mas rapido?",,IESS,,,,
Que tiempo aproximadamente se demoran en un estudio de jubilacio patronal,,Jubilacion Patronal,,,,
Que tiempo aproximadamente se demoran en un estudio de recursos humanos,,Consultoria,,,,
"queria hacer una pregunta: existe alguna disposicion de la super de la aplicacion de una tasa de descuento especifica? 
3% o 7% o cualquiera de las tasas son aceptadas en ecuador?",,Jubilacion Patronal,empresa,0,,
Queria un estudio actuarial,,Jubilacion Patronal,,,,
Quiciera saber si ya puedo jubilarme por favor puede explicar,,IESS,,,,ambivalente
Quiciera saber si ya puedo jubilarme por favor puede explicar,,Jubilacion Patronal,,,,ambivalente
quien es Ivan Ramirez?,,No Topic,,,"por lo pronto se pone como no topic, podria ser para nuevo topic",
Quiero conocer su oferta ,,No Topic,,,,
Quiero conocer su oferta en temas de ,,No Topic,,,,
Quiero conocer su oferta en temas de consultoria matematica,,Consultoria,,,,
Quiero conocer su oferta en temas de recursos humanos,,Consultoria,,,,
Quiero conocer su oferta en temas de seguros,,Consultoria,,,,
Quiero conocer su oferta en temas financieros,,Otros servicios,,,,
Quiero desarrollar un modelo de Topic/Sentiment Análisis en Redes Sociales con ayuda de ACTUARIA,,Consultoria,,,,
quiero hacer el calculo por deshaucio,,Renuncia/Despido/Desahucio,,,,
Quiero poner una queja por el mal servicio que dan,,Queja,,NP,,
"quiero realizaPROVEEDOR DE TECNOLOGIA S A
quiero hacer el càlculo actuarial en linea
supe que ya es posible
hay que bajar alguna plataforma",,Jubilacion Patronal,,,,
Quiero saber cuando me depositan el dinero de acta finiquito ya hize de la cuentas bancarias,,Renuncia/Despido/Desahucio,persona,0,,
quiero saber cuando me entregan el estudio actuarial que estoy haciendo con ustedes?,,Jubilacion Patronal,,,,
quiero saber donde estan ubicados,,Contacto,,,,
quiero seaber si puedo jubilarme con cuanto me quedo  mensualmente gracia podria ayudarme,,IESS,,,,ambivalente
quiero seaber si puedo jubilarme con cuanto me quedo  mensualmente gracia podria ayudarme,,Jubilacion Patronal,,,,ambivalente
quiero trabajar en ACTUARIA?,,trabaje con nosotros,,,,
Quisiera enviar mi cv para que sea considerado ,,trabaje con nosotros,,,,
Quisiera me ayudaran con las ventajad y desventejas de aplicar el calculo de la media grometrica y aritmetica  en las pensiones de los jubilados   me ayudarian a obtener un mejor panorama sobre este tema es pars mi tesis gracias ¡¡¡,,IESS,,,,
quisiera me ayude con el calculo de pensión jubilar,,Jubilacion Patronal,,,,
"quisiera me ayuden con un calculo actuarial 
por favor",,Jubilacion Patronal,,,,
Quisiera q me ayude con un ejemplo de desahucio,,Renuncia/Despido/Desahucio,,,,
Quisiera saber cuánto me dieran de liquidación por renuncia voluntaria por 1 amo 1/2,,Renuncia/Despido/Desahucio,persona,0,,
quisiera saber que hacen,,No Topic,,,,
Quisiera saber que reconocen en muerte de un jubilado ,,IESS,,,,
Quisiera saber si estan buscando personal,,trabaje con nosotros,,,,
Quisiera saber si estan contratando,,trabaje con nosotros,,,,
"Quisiera saber si mi mamá ya puede Jubilarse en la empresa donde trabaja, y cómo es el tema de la jubilacion en el IESS y cuáles son las bases legales vigentes.
mi mamá trabaja en una empresa privada
ya lleva trabajando 27 años",,IESS,,,,ambivalente
"Quisiera saber si mi mamá ya puede Jubilarse en la empresa donde trabaja, y cómo es el tema de la jubilacion en el IESS y cuáles son las bases legales vigentes.
mi mamá trabaja en una empresa privada
ya lleva trabajando 27 años",,Jubilacion Patronal,,,,ambivalente
Quisiera saber si puedo acceder a capacitación sobre la Nic 19 y Gestión Financiera ,,Charlas/Capacitaciones,,,,
"quisiera saber si yo tengo el sindrome del tunel del carpo en mi mano y brazo es considerada enfermedad laboral 
y en caso de que me quisieran realizar un despido intempestivo la empresa donde laboro que debo hacer si aun estoy en rehabilitacion y al parecer requiero de una operacion",,Renuncia/Despido/Desahucio,,,,
quisiera saber su ustedes dan asesoria financiera a pymes?,,Otros servicios,empresa,0,,
Quisiera una cotización de un estudio actuarial,,Jubilacion Patronal,empresa,0,,
Realizan Análisis de Inventarios?,,Consultoria,,,,
Realizan Análisis de Series de Tiempo?,,Consultoria,,,,
Realizan avaluos de propiedades,,Otros servicios,,,,
Realizan consultorias en temas financieros,,Otros servicios,,,,
Realizan modelado matematico?,,Consultoria,,,,
Reciban un cordial saludo de parte mía,,Greeting,,,,
Recibimos oficio adjunto de SCVS. Favor confirmar si con cambios hechos en ultimo pedido de justificación de NT hecho por ustedes ahora es lo que se solicita en oficio adjunto. Y por otro lado necesitamos la nota técnica dental donde se corregida el wording     e incluyendo los registros de las aprobaciones correspondiente para NT y Tarifa de prima. Favor su valiosa y acostumbrada ayuda porque es urgente. Gracias,,Consultoria,,,,
"Reporte de siniestralidad, se está incluyendo dentro de la obligación para el licitante, que además del envió de reporte de siniestralidad (20 de cada mes) deberá de enviarlo completo de acuerdo a los campos del formato 1 (formato de siniestralidad).

 

2.       penalizaciones, se está agregando en la pena por no entregar el reporte de siniestralidad los 20 de cada mes, el que tambien aplica la penalización si el reporte no se entrega completo con la información solicitada en el formato 1.

 

3.       En seguimiento al tema de los siniestros, se señala con rojo en la página 10 del anexo técnico, como aplica la parte del reembolso en cuanto los tiempos para conocimiento de UNOPS.",,Consultoria,,,,
REPRESENTANTE LEGAL DE LOS COLEGIOS:,,No Topic,,,,
"Requeri servicios de ACTUARIA y tuvimos que lidiar con gent desagradable, personal con conocimiento muy bajo y altas demoaras",,Queja,,,,
Requiero actualizar el estudio actuarial realizado por ustedes para el ejercicio 2017,,Jubilacion Patronal,empresa,0,,
requiero ayuda,,No Topic,,,,
requiero cotizacion de sus servicios,,No Topic,,,,
Requiero de una nota técnica para póliza de responsabilidad civil,,Consultoria,,,,
Requiero el desarrollo de un Modelo Predictivo,,Consultoria,,,,
requiero sus servicios,,No Topic,,,,
requiero sus servicios para ayuda,,No Topic,,,,
"REQUISITOS PARA EL MONTE PIO DE LA VIUDA.
RESIDE EN BABAHOYO
Y SI LOS REQUISITOS SE LOS ENTREGA EN GUAYAQUIL.
El FALLECIÓ EL DE 14 DE FEBRERO PERO NO SE PRESENTARON LOS DOCUMENTOS ANTES YA QUE RECIEN LE DIERON EL CERTIFICADO DE MATRIMONIO DESPUES DE HABER SIDO DEMANDADO EL REGISTRO CIVIL .
Y QUE TIEMPO DURA PARA EL DEPOSITO A LA CUENTA DE LA VIUDA .
ELLA ES PERSONA CON DISCAPACIDAD DEL %76",,IESS,,,,
reservas para el seguro de vehiculos,,Consultoria,,,,
Riesgo financiero,,Otros servicios,,,,
"Riesgo financiero: crediticio, de inversión, interno y externo",,Otros servicios,,,,
saben cual es la calle donde quedan las oficinas de ACTUARIA?,,Contacto,,,,
saben donde queda michoacan?,,No Topic,,,,
saluda alberto,,Greeting,,,,
saludos ,,Greeting,,,,
"Saludos buen día
Cuales son los derechos de la viuda....",,IESS,,,,
saludos cordiales,,Greeting,,,,
"Saludos cordiales mi mamá desea jubilarse va cumplir 65 pero sus aportaciones han sido interrumpidas hasta por 3 años con 16 años de aportes. Será que puede jubilar??
Actualmente sigue aportando",,IESS,,,,ambivalente
"Saludos cordiales mi mamá desea jubilarse va cumplir 65 pero sus aportaciones han sido interrumpidas hasta por 3 años con 16 años de aportes. Será que puede jubilar??
Actualmente sigue aportando",,Jubilacion Patronal,,,,ambivalente
"Saludos, deseo saber cual seria el coto de un estudio actuarial",,Jubilacion Patronal,,,,
seguro de vehiculos,,Consultoria,,,,
Señor actuario mi nombre es Jorge Noboa ; necesito saber lo siguiente he venido aportando la cantidad de usd 100 y desde mediados de este año vengo aportando usd300 y está cantidad Dios mediante quiero seguir aportando hasta diciembre del 2019 que cumplo los 65 años de edad; creo que hasta ese tiempo cumplo 24 o 25 años de aportaciones.Pregunta con  la cantidad que aportó mejóraré en algo mi jubilación y cuanto aproximadamente me darían l,,IESS,,,,
"Señores Actuaria buenas tardes, me permito molestar su atención con una consulta referente al ejemplo que esta en internet sobre el cálculo de pesión del IESS cuando existen variaciones significativas en las remuneraciones con la fórmula anterior y la actual, en el establecen que de acuerdo al promedio simple sería 1.520 y con el nuevo cálculo sería 965.73, de ser posible por favor ayúdenme indicando como llego al valor de 965.73",,IESS,persona,0,,
Señores de Actuaria buenas tardes,,Greeting,,,,
señorita una pregunta mi padre trabaja 36 años en una hacienda privada llamada la querencia mi pdre actualmente tiene 65 años y 125 aporte al iess puedo hacerle una jubilacion patronal o no..........  solo eso ayudeme por favor,,IESS,,,,ambivalente
señorita una pregunta mi padre trabaja 36 años en una hacienda privada llamada la querencia mi pdre actualmente tiene 65 años y 125 aporte al iess puedo hacerle una jubilacion patronal o no..........  solo eso ayudeme por favor,,Jubilacion Patronal,,,,ambivalente
sera que me pueden ayudar con eso,,No Topic,,,,
servicio de asesoria en recursos humanos,,Consultoria,,,,
servicio de jubilacion patronal,,Jubilacion Patronal,,,,
servicios,,No Topic,,,,
servicios de consultoria,,Consultoria,,,,
si,,No Topic,,,,
"Si eres trabajador de una empresa. Busca, compara y propone a tu empleador la mejor capacitación. ",,Charlas/Capacitaciones,,,,
Si retiro mi cesantia puedo en su momento una vez cumplidos los requisitos jubilarme???,,Jubilacion Patronal,,,,
Si se puede jubilación,,IESS,,,,ambivalente
Si se puede jubilación,,Jubilacion Patronal,,,,ambivalente
si tienen oficinas en guayaquil,,Contacto,,,,
Si una persona abandona el trabajo tiene derecho a desahucio?,,Renuncia/Despido/Desahucio,,,,
"Si una persona ha iniciado trámite de jubilación en el Iess ,¿  Podría  trabajar en la misma empresa facturando ? Enviarme respuesta a orounion@yahoo.com",,IESS,,,,
Si uno pone la renuncia uno no puede cobrar cesantia,,Renuncia/Despido/Desahucio,,,,
Sigan asi. Muchas grascias,,Hi Five,,,,
sistemas presupuestarios,,Otros servicios,,,,
"Solicité una cotización y me enviaron dos precios una como NIIF y otra cómo NEC, cuál es la diferencia por favor me podrían aclarar.",,Jubilacion Patronal,empresa,0,,
"Solicitó información de:los aportes del seguro campesino ,de las damas del hogar, y los costos que representan la atención a los hijos de los trabajadores gracias.",,IESS,,,,
"Somos de la compañía TRANSLIBERTADOR S.A., ustedes nos hicieron el favor de realizar el estudio actuarial de jubilación patronal y de desahucio. Existe alguna posibilidad de que nos ayuden guiando con el registro contable de los mismos.",,Jubilacion Patronal,empresa,0,,
Son peritos evaluadores?,,Otros servicios,,,,
Son una muy buena empresa,,Hi Five,,,,
"Soy maestra fiscal, ya tengo 60 años, 34 de aportaciones y el carnet de discapacidad del 36 %, presente mi solicitud para que se me tome en cuenta en el proceso de jubilación. Me llamaron hoy para indicarme que estoy aceptada para jubilarme por discapacidad pero yo no se si debo firmar este tipo de jubilación, ya que yo he escuchado que cuando se jubila por este motivo no se recibe el porcentaje de liquidación que debería recibir por mi edad y mi tiempo de servicio 
Por favor si me pueden orientar ya que debo firmar el día de mañana mi aceptación",,IESS,,,,
"soy proveedor, deseo enviar una factura",,Facturacion/Retencion/Cobros,,,,
Soy representante legal,,No Topic,,,,
"SOY TRABAJADOR PUBLICO  TENGO 63 AÑOS 8 MESES  UNA REMUNERACION DE 818,22  TENGO 375 APORTACIONES Y POR MI ENFERMEDAD PEDI DESAHUCIO A LA iNSTITUCION DONDE TRABAJO DESDE EL AÑO 2000, COMO PUEDO JUBILARME EN EL IESS Y JUBILACION PATRONAL .. MUY AGRADECIDO  POR SU AYUDA,",,IESS,,,,ambivalente
"SOY TRABAJADOR PUBLICO  TENGO 63 AÑOS 8 MESES  UNA REMUNERACION DE 818,22  TENGO 375 APORTACIONES Y POR MI ENFERMEDAD PEDI DESAHUCIO A LA iNSTITUCION DONDE TRABAJO DESDE EL AÑO 2000, COMO PUEDO JUBILARME EN EL IESS Y JUBILACION PATRONAL .. MUY AGRADECIDO  POR SU AYUDA,",,Jubilacion Patronal,,,,ambivalente
"SOY TRABAJADOR PUBLICO  TENGO 63 AÑOS 8 MESES  UNA REMUNERACION DE 818,22  TENGO 375 APORTACIONES Y POR MI ENFERMEDAD PEDI DESAHUCIO A LA iNSTITUCION DONDE TRABAJO DESDE EL AÑO 2000, COMO PUEDO JUBILARME EN EL IESS Y JUBILACION PATRONAL .. MUY AGRADECIDO  POR SU AYUDA,",,Renuncia/Despido/Desahucio,,,,
"Soy una persona dependiente de mi exesposo y el está apunto de jubilarse patronalmente yo como esposa legitleg recibo de ese dinero ayudenme quiero estar asesorada para poder reclamar mis derechos disculpe la molestia porfavor estoy bien preocupada
Gracias de antemano",,Jubilacion Patronal,,,,
SOY x CUANDO ME ENTREGAN EL ESTUDIO,,Jubilacion Patronal,,,"se deriva a jub patronal, se podria revisar (otro topic)",
SOY x CUANDO ME ENTREGAN EL ESTUDIO de jubilacion patronal,,Jubilacion Patronal,,,,
SOY x CUANDO ME ENTREGAN EL ESTUDIO de notas tecnicas,,Consultoria,,,,
SOY x CUANDO ME ENTREGAN EL ESTUDIO de recursos humanos,,Consultoria,,,,
"Srta  DISCULPE  PERO LA  SRTA. KATHERINE DIAZ ME ENVIA UN CORREO QUE NO SE HA CANCELADO EL ESTUDIO ACTUARIAL  DE e CON RUC  r  PERO ESO SE PAGO  Y SE ENVIO LA FACTURA Y LA RESPECTIVA RETENCION AL CORREO  venta5@actuaria.com.ec y en este momento se reenvio un correo a la srta
katherine Diaz
POR FAVOR CONFIRMAR",,Facturacion/Retencion/Cobros,,,,
"Srta. Daniela envie el comprobante de pago por el estudio actuarial de e  con RUC 1390071066001, me dijeron que con el pago me enviaban el trabajo del Estudio Actuarial me podria decir si ya lo tiene por q necesito enviar los balances  a Rentas gracias",,Facturacion/Retencion/Cobros,,,,
"stimados, buenos dias.......necesito una guia para poder ingresar a su pagina y revisar las facturas que nos emiten......por favor.......gracias",,Facturacion/Retencion/Cobros,,,,
Su ayuda con requisitos y precio para realizar el estudio,,No Topic,,,,
Su producto de Clima Laboral R2O mide tambien temas de lugar de trabajo?,,Consultoria,,,,
Su servicio está muy bien calidad/precio.,,Hi Five,,,,
"supuestamente Correa emitió el decreto 225 dodne aquellos que tenian 12años a la fecha del mensionado decreto, perdian la jubilacion patronal 12 años 5meses de servicio perdía la jubilacion patronal",,Jubilacion Patronal,persona,0,,
tableros de control,,Otros servicios,,,,
talvez,,No Topic,,,,
talvez realizan servicios,,No Topic,,,,
temas de inteligencia artificial ,,Consultoria,,,,
"tenemos solo empleado al conserje con salario básico desde el 2000 cuánto nos cobran por solo el cálculo actuarial de esta persona para evaluar requiero si lo despido este año 19 o lo despido el otro que tiene 20 
o si mejor espero a su jubilación en 6 años",,Renuncia/Despido/Desahucio,persona,0,,
"Tenemos una Empresa Pequeña 
necesitamos asesoria Financiera, contable, tributaria, 
Ustedes pueden Ayudarnos con eso",,Otros servicios,,,,
"TENGO 20 AÑOS DE APORTES  (15 EN LA MISMA EMPRESA) Y 56 AÑOS DE EDAD , QUE POSIBILIDAD TENGO DE ACOGERME A UNA JUBILACION. GRACIAS",,Jubilacion Patronal,persona,0,,
"Tengo 24 años trabajando para la misma empresa los primeros 5 años para la empresa después 7 años nos tercerizaron a una contratista en la misma empresa y estos últimos 12 años nos regresaron a la empresa, tengo derecho a la jubilación patronal por los 24 años que e laborado terserizado o no.",,Jubilacion Patronal,,,,
tengo 27 años de servicio y mi sueldo estipulado es de 650 dolares para la jubilación patronal global cuanto debería resivir,,Jubilacion Patronal,,,,
Tengo 40 años de aporte los ultimos 12 ms aporto como profesional 2000 aparte de lo que aporto en relacion dep. que es 1200 me suman estos valores para la jubilacion patronal y cuanto seria la pension? Gracias estimados señores,,Jubilacion Patronal,,,,
Tengo 40 años de aporte los ultimos 12 ms aporto como profesional 2000 aparte de lo que aporto en relacion dep. que es 1200 me suman estos valores para la jubilacion y cuanto seria la pension? Gracias estimados señores,,Jubilacion Patronal,,,,ambivalente
