Pregunta,respuesta,Tema,Pers/empresa,Polarity,Nota,ambiguedad
"Hola me gustaría saber si tienen alguna capacitacion vigente con respecto a legislacion laboral, obligaciones societarias afines",,Charlas/Capacitaciones,empresa,0,,
hola me podria explicar mas del tema de machine learning,,Consultoria,persona,0,,
hola me puedes ayudar con informacion sobre capacitaciones en Sguros,,Charlas/Capacitaciones,empresa,0,,
Hola mi nombre es Miguel Fernando Salvatierra Muñoz,,Greeting,,,,
Hola mi nombre es Miguel Fernando Salvatierra Muñoz.,,Greeting,,,,
Hola mi nombre es Víctor loachamin tengo 55 años y tengo 30 años de aportación al iess me puedo jubilarme ya o no todavía,,IESS,,,,
hola muy buen dia... quisiera me ayuden con informacion ya que estoy buscando un curso de capacitacion,,Charlas/Capacitaciones,,,,
HOLA POR FAVOR ME PUEDEN AYUDAR CON LOS NUMERO TELEFÓNICOS DE GUAYAQUIL.,,Contacto,,,,
Hola qué tal ,,Greeting,,,,
hola quiero saber si ustedes pueden ayudarme a hacer todo el trámite para la obtención de mi jubilación patronal.  Crees que es conveniente pedirla a mi empleador o esperar al despido.  Si ustedes no hacen este trámite tienes alguna persona que me recomiendes,,Jubilacion Patronal,,,,
Hola quisiera saber el valor correspondiente de 1 año 6 meses de trabajo y el tiempo de dar la liquidacion,,Renuncia/Despido/Desahucio,,,,
Hola quisiera saber si cuales son las fechas de capacitaciones de talento humano y laboral,,Charlas/Capacitaciones,empresa,0,,
"Hola soy trabajador de una compañia ppr mas de 25 años, me acaban de liquidar,  mi pregunta es, cuanto tengo que recibir por jubilación patronal,???, este valor 3s un monto fijo total o es mensualmente ???",,Jubilacion Patronal,,,,
Hola tengo 32 años de aportaciones  al biess y tengo 57 años de edad y dos meses puedo jubilarme o esperar hasta cumplir los 60 años de edad,,IESS,,,,
Hola Una consulta en que consiste el despido por desausio ,,Renuncia/Despido/Desahucio,persona,0,,
Hola una consulta para que fecha tienen capacitaciones,,Charlas/Capacitaciones,empresa,0,,
hola una pregunta de jubilacion,,IESS,,,,ambivalente
hola una pregunta de jubilacion,,Jubilacion Patronal,,,,ambivalente
Hola una pregunta en que perjudica el acta de finiquito por una liquidación,,Renuncia/Despido/Desahucio,persona,0,,
Hola yo tengo 62 años pero no tengo treinta años aportando sino 5 años me puedo jubilar xf quiero saber,,IESS,,,,ambivalente
Hola yo tengo 62 años pero no tengo treinta años aportando sino 5 años me puedo jubilar xf quiero saber,,Jubilacion Patronal,,,,ambivalente
"Hola
puedo hacer una consulta?",,Greeting,,,,
"hola, actualmente trabajo como tecnico en la cnt mi contrato esta bajo la losep en caso de jubilarme recibiria jubilacion patronal y jubilacion del iess?",,IESS,,,,ambivalente
"hola, actualmente trabajo como tecnico en la cnt mi contrato esta bajo la losep en caso de jubilarme recibiria jubilacion patronal y jubilacion del iess?",,Jubilacion Patronal,,,,ambivalente
"Hola, buenos días",,Greeting,,,,
"Hola, integrar en un único lanzamiento de encuesta la evaluación 360 y el cuestionario de clima sería aconsejable?",,Consultoria,empresa,,,
"Hola, me llamo Isabel Jijon, quería saber si hay opciones de trabajo en ACTUARIA consultores?",,trabaje con nosotros,,,,
"hola, soy afiliado voluntario en el exterior ¿cuantos años tengo que aportar para jubilarme con el 100% ?",,IESS,,,,
"hola, tengo una duda me jubile en el mes de diciembre de 2018, con 57 años de edad y 400 aportaciones, y tengo el 45% de discapacidad, pero el coeficiente de calculo me lo aplican por 300 aportaciones no por las 400 que tengo, ayudeme que procedimiento debería seguir para que me paguen lo justo",,IESS,persona,0,,
"Hola, una persona que laboro como servicio domestico como 30 años esta obligado a recibir la jubilacion patronal.  Muchas gracias",,Jubilacion Patronal,persona,0,,
"Hola, yo trabaje desde el 91 hasta el 99, tengo 52 años he dejado de trabajar 19 años mi pregunta como puedo hacer para tener derecho a la jubilación de el IESS",,IESS,,,,
Hola. Las cuentas por pagar patronales pueden ser pagadas hasta una fecha limite?,,Jubilacion Patronal,,,,
Hola…. Si mis 2 últimas aportaciones fueron sobre un salario básico… Afectaría mi promedio de jubilación de el IESS que era más alto…. Gracias,,IESS,,,,
Información sobre capacitación en jubilación patronal,,Charlas/Capacitaciones,,,,
jubilacion iess,,IESS,,,,
jubilación iess,,IESS,,,,
jubilacion patronal,,Jubilacion Patronal,,,,
jubilación patronal,,Jubilacion Patronal,,,,
jubilacion patronal y de el IESS,,IESS,,,,ambivalente
jubilacion patronal y de el IESS,,Jubilacion Patronal,,,,ambivalente
"La diferencia se debe al ajuste que realizamos, al momento de usar un espectro más grande de límites de cobertura, los parámetros promedio de la base  también cambian, en este caso el límite y deducible promedio de la base cambiaron. Esto se ve reflejado en que la diferencia está entre $1.36 y $9.34 lo cual no es una diferencia significativa sino debido al ajuste que se realiza. 

Estoy pendiente a cualquier duda adicional. ",,Consultoria,,,,
"la empresa requiere el estudio individual de jubilación patronal de un colaborador 
que es gerente",,Jubilacion Patronal,,,,
La hora de la capacitacion mañana por favor,,Charlas/Capacitaciones,,,,
"La inteligencia artificial o, para abreviar, IA, es uno de los grandes objetivos de la informática desde hace muchos años.",,Consultoria,,,,
"La Ley de Seguridad Social vigente señala que tendrán derecho a jubilación de vejez, los afiliados que hayan cumplido los requisitos detallados
en la Tabla 2",,IESS,,,,
"La provision pàra juvilacion patronal y desaucio, todo se va Impuestos Diferidos o solo de quienes tienen menos de 25 años de trabajo ?",,Jubilacion Patronal,,,,ambivalente
"La provision pàra juvilacion patronal y desaucio, todo se va Impuestos Diferidos o solo de quienes tienen menos de 25 años de trabajo ?",,Renuncia/Despido/Desahucio,,,,ambivalente
la raiz sesentava,,IESS,,,,
la tradición presente ,,No Topic,,,,
La.jub. patronal.no tiene derechos solo.en salario.que.le asigne la empresa. Jub del iess.si tiene derechos todos di cumple. 60.anos.y 30 anos en varias empresa. Rdto no es invento se otorga desde mas de 85 anos. Y mas. No es intetpretar sino cumplir la ley,,IESS,,,,ambivalente
La.jub. patronal.no tiene derechos solo.en salario.que.le asigne la empresa. Jub del iess.si tiene derechos todos di cumple. 60.anos.y 30 anos en varias empresa. Rdto no es invento se otorga desde mas de 85 anos. Y mas. No es intetpretar sino cumplir la ley,,Jubilacion Patronal,,,,ambivalente
Las empresas están utilizando la inteligencia artificial ahora más que nunca. Desde los bancos que entrenan IA para facultar a su fuerza de trabajo digital hasta las empresas de telecomunicaciones que establecen chat bots inteligentes para transformar el servicio al cliente,,Consultoria,,,,
"Las estructuras de las unidades lingüísticas del texto son diferentes en cada idioma.

Por ejemplo, en español el adjetivo y el artículo que determina el género y número cambian según el sujeto, mientras que en inglés no se modifican.

Si hablamos de una mujer, un hombre, varias chicas o varios muchachos, diremos que la mujer es delgada, el hombre es delgado, las chicas son delgadas y los muchachos son delgados, lo que demuestra que en español se modifica el género y el número del artículo y el adjetivo de la oración, dependiendo del sujeto del que hablemos.

Además hay una diferencia en la posición en la que se ubican los componentes de la oración en los textos en español.",,No Topic,,,,
Le escribo de la empresa Baltic Reefers. Nos han sido referenciados por uno de nuestros clientes para la elaboracion de un estudio actuarial nos gustaria conocer costos y el tiempo de entrega,,Jubilacion Patronal,empresa,0,,
"le estamos saludando de la compañia vanon sa, quisiera me ayude con una cotización para el estudio actuarial del año 2018. ",,Jubilacion Patronal,,,,
Le felicito su pagina es excelente.,,Hi Five,,,,
"Le felicito su pagina es excelente.Cumplo 65 años en Marzo 2019, tengo 182 aportaciones al IESS y mis 5 mejores años gane $1000 mensuales; cuanto seria el monto de mi juibilacion 
me llamo Magadalena",,IESS,,,,
Le felicito su pagina es muy buena.,,Hi Five,,,,
Le odio a la empresa ACTUARIA,,Queja,,,,
"Le saluda Claudia Camino de ZHM Seguros, nosotros ya trabajamos un estudio actuarial con uds actualmente requiero cotizar un estudio de jubilación patronal de una colaboradora que requiere jubilarse",,Jubilacion Patronal,empresa,0,,
le saluda Mayra Allo de la compañia Vanon sa con Ruc 0992278315001,,Greeting,,,,
le saluda Miguel Zamora le acabe de enviar con correo a la Ventas3 favor para que lea mi correo y me conteste gracias,,Contacto,,0,,
"Le saludo de la firma de auditoria Mackliff Audit Corporation, Queria un estudio actuarial ","Buenos días 
me ayuda con los siguientes datos por favor: ruc, nombre empresa, contacto, cargo, correo y teléfonos ",Jubilacion Patronal,empresa,0,,
Lenin Torres,,No Topic,,,,
"Les estoy enviando un escrito
pidiendo una cotizacion
mi cel 0998408178",,No Topic,,,,
Liquidación por desahucio por 7 años,,Renuncia/Despido/Desahucio,,,,
Me encuentro cesante desde hace dos meses como educador preguntó si tengo el derecho a la pensión patronal vitalicia como docente que fui X 31 años consecutivos el Ministerio de educación,,Jubilacion Patronal,persona,0,,
Me gustarìa saber respecto a la bonificación por desahucio,,Renuncia/Despido/Desahucio,persona,0,,
me gustaria saber si estan necesitando personal,,trabaje con nosotros,,,,
"me gustaría saber si ustedes pueden agendar una cita para mí para la próxima semana, necesito consultar un problema de índole laboral que se me presentó hace algún tiempo.",,No Topic,,,,
Me parece bueno el servicio que dan,,Hi Five,,PP,,
"Me parece bueno el servicio que dan, mi pregunta es: qué puedo hacer para mejorar mi pensión jubilar, puesto que en febrero del 2020 cumplo los 60 años de edad y tengo 451 aportaciones",,IESS,persona,0,,ambivalente
"Me parece bueno el servicio que dan, mi pregunta es: qué puedo hacer para mejorar mi pensión jubilar, puesto que en febrero del 2020 cumplo los 60 años de edad y tengo 451 aportaciones",,Jubilacion Patronal,persona,0,,ambivalente
"me podria ayudar con algun numero y extension para comunicarme con un asesor
y que me indiquen que tendría que hacer el calculo actuarial",,Contacto,,,,
Me podría ayudar que es desahucio,,Renuncia/Despido/Desahucio,,,,
ME PODRIA INDICAR COMO HAGO PARA EL CALCULO DE DE JUBILACION PATRONAL,,Jubilacion Patronal,persona,0,,
Me podria por favor ayudar con algun numero de teléfono para contactarlos aca en gye,,Contacto,,,,
me podrían ayudar con el calculo de mi jubilación patronal ya que voy a cumplir el próximo mes 25 años de servicio ,,Jubilacion Patronal,,,,
me puede ayudar con  un  numero para contactarme,,Contacto,,,,
me puede ayudar con el número de teléfono por favor,,Contacto,,,,
me puede ayudar con un contacto al que me pueda comunicar,,Contacto,,,,
me puede ayudar?,,No Topic,,,,
Me pueden ayudar con informacion de su producto para revalorizar bienes inmuebles?,,Otros servicios,,,,
Me pueden ayudar desarrollando Algoritmos de Venta Cruzada?,,Consultoria,,,,
me puedes ayudar con que entidades de pension salud  tienen en ecuadro,,Consultoria,,,,
"Me quiero quejar, es el colmo su servicio",,Queja,,,,
ME SIENTO ACOSADA EN MI TRABAJO Y CREO QUE ES PORQUE YA TENGO 21 AÑOS TRABAJANDO EN LA MISMA EMPRESA. ES POSIBLE JUBILARME PROPORCIONALMENTE  PATRONALMENTE . ES INSOSTENIBLE Y DESEO SABER CUANTO ME PAGARIAN MENSUAL Y SI PUEDO TRABAJAR EN OTRO LADO LUEGO DE JUBILARME PATRONALMENTE SI ES QUE ES POSIBLE,,Jubilacion Patronal,,,,
Me siento engañado. No recomiendo esta empresa,,Queja,,,,
me trataron pesimo jose repetto me grito y se demoro 5 horas en darme una reserva,,Queja,,,,
"MI ABUELA MURIÓ HACE MAS DE 10 AÑOS PERO ELLA LABORO EN UNA ENTIDAD PUBLICA POR MAS DE 40 AÑOS, PERO NADIE HIZO NINGÚN RECLAMO ACERCA DE MONTEPÍO NI TIEMPO DE TRABAJO EN EL LUGAR DONDE TRABAJÓ, HABRÍA LA POSIBILIDAD DE AUN REALIZAR ALGÚN TRAMITE PARA PAGO?",,IESS,,,,
mi celular es el 0988046873 ruego comunicarse para que preste sus servicios en reclamar una jubilacion patronal ya que me retire de mi trabajo hace tres años  para jubilarme me falta 1 año 5 meses y quiero reclamar la patronal defiendame por favor,,Jubilacion Patronal,,,,
"mi empresa no ha hecho calculo actuarial para el año 2017, quiero saber cuanto mas o menos es el costo de ese servicio
que debo enviarle para la cotizacion
mis empleados fijos 70 y tengo unos 30 pero son por contratos de obra,,,,,",,Jubilacion Patronal,,,,
mi empresa Tiene 10 trabajadores y empezamos a contratar trabajadores desde el 2017 necesito saber si estoy obligado a realizar el estudio actuarial,,Jubilacion Patronal,empresa,0,,
Mi esposo se jubilo por invalidez total absoluta Que tipo de indemnización debe tener? O que fondos debería retirar,,IESS,persona,0,,
Mi interés está relacionado con consultas sobre: Desarrollo de Productos de Seguro Diseño y acompañamiento en la aprobación de nuevos productos y planes de seguros,,Consultoria,empresa,,,
Mi madre murió siendo jubilada hay algún cobro al que tengamos derecho dos hijos mayores de edad????,,IESS,persona,,,
Mi papá era afiliado pero era afiliado pero no estaba casado con mi mamá …. me indicaron que podía mi mamá hacer una declaración juramentada como cónyuge sobreviviente que eso reemplaza la unión de hecho se puede hacer o no para acceder a montepio …. y en el caso de devolución de aportes por muerte como puedo acceder en caso que no se pueda recibir montepio gracias,,IESS,,,,
mi pregunta  a 27 años de trabajo cuanto en una empresa agricola  y que  se cambio de razon social  por tres acaciones a cuanto  es el porcentaje  que se  debe hacer el calculo,,Jubilacion Patronal,empresa,0,,
Mide la percepción de los trabajadores sobre el nivel de liderazgo y de ajuste de competencias al cargo de sus jefes,,Consultoria,,,,
Mónica Calderón independiente y Estrella Torres Juanis Spa,,No Topic,,,,
muchas gracias,,Hi Five,,,,
Muchas gracias,,Hi Five,,,,
Muchas gracias por la atención,,Hi Five,,,,
muchas gracias por su ayuda,,Hi Five,,,,
"Muchas gracias por su ayuda, sigan asi!",,Hi Five,,,,
Muy buen servicio,,Hi Five,,PP,,
Muy buena empresa gracias por su servicio,,Hi Five,,,,
Muy buenas tarde un gusto saludarle quisiera información de costos sobre un cálculo global de jubilación patronal tal vez me puedan ayudar por este medio ? Gracias,,Jubilacion Patronal,,,,
"Muy buenas tardes
Mi pregunta versa sobre una funcionaria que ha solicitado ya 180 dias de permiso por enfermedad
ya el sistema no permite otro dia mas de permiso
tiene que reincorporarse a su puesto el 22 de Mayo de 2019, pero su estado actual no le permite trabajar ya que no puede caminar y ha quedado ciega
Ya presento su solicitud por invalidez pero se le nego, la funcionaria impugno y aun no responde
Como empleador como se puede hacer para pagarle el subsidio por enfermedad y como la podriamos jubilar tiene 52 años de edad",,IESS,,,,
"Muy buenas tardes, con el máximo respeto me dirijo para que me ayude con una consulta. Soy Rector de una institución educativa particular actualmente por tengo el contrato por servicios profesionales, ya que me descontaban el 40%. (Por ser militar jubilado). Deseo saber si efectivamente quedó sin efecto ese descuento para solicitar el contrato en Relación de dependencia. edisonmorenoperez24@hotmail.com",,IESS,persona,0,,ambivalente
"Muy buenas tardes, con el máximo respeto me dirijo para que me ayude con una consulta. Soy Rector de una institución educativa particular actualmente por tengo el contrato por servicios profesionales, ya que me descontaban el 40%. (Por ser militar jubilado). Deseo saber si efectivamente quedó sin efecto ese descuento para solicitar el contrato en Relación de dependencia. edisonmorenoperez24@hotmail.com",,Jubilacion Patronal,persona,0,,ambivalente
"Muy buenas tardes. Soy beneficiario del ISSFA  con el 40% de invalidez, tengo el carnet del Conadis. Laboro en una empresa pribada y estoy por cumplir las 300 imposiciones en el IESS , mi consulta es si puefo acogerme  a la jubilación especial considerando q soy beneficiario del ISSFA",,IESS,,,,
"Muy buenas tardes... A nombre de la empresa La Señora de las Llantas ubicada en la ciudad de Guayaquil solicitamos información sobre sus servicios ......los requisitos, el costo, el procedimiento y el tiempo que ustedes llevan para desarrollar el Estudio Actuarial... por favor enviar la información al siguiente correo rarce@lasenoradelasllantas.com .... gracias por su pronta respuesta",,Jubilacion Patronal,,,,
"Muy buenas tardes... A nombre de la empresa La Señora de las Llantas ubicada en la ciudad de Guayaquil solicitamos información sobre sus servicios ......los requisitos, el costo, el procedimiento y el tiempo que ustedes llevan para desarrollar el Estudio Actuarial... por favor enviar la información al siguiente correo rarce@lasenoradelasllantas.com .... gracias por su pronta respuesta.",,Jubilacion Patronal,,,,
"Muy buenas tardes... Excelente página .. Consulto cumplo 60 años el 4 de octubre de este año y 430 aportaciones, trabaje hasta el 15 de este mes... Cuando me puedo jubilar .",,IESS,,,,ambivalente
"Muy buenas tardes... Excelente página .. Consulto cumplo 60 años el 4 de octubre de este año y 430 aportaciones, trabaje hasta el 15 de este mes... Cuando me puedo jubilar .",,Jubilacion Patronal,,,,ambivalente
"Muy buenos dias 
por favor me podria ayudar con un numero de contacto ",,Contacto,,,,
"Muy buenos dias 
por favor me podria ayudar con un numero de contacto para consultar el ingreso de informacion para el calculo actuarial 
2018",,Jubilacion Patronal,,,,
"Muy buenos días. mi nombre Zamaris Jaén, mi correo personal zamarisjaen@gmail.com",,Greeting,,,,
"Muy mal servicio, totalmente decepcionados, cambien",,Queja,,,,
necesitamos realizar un estudio ,,No Topic,,,,
necesito,,No Topic,,,,
necesito algo,,No Topic,,,,
Necesito asesoría en Integración y Depuración de Datos,,Consultoria,,,,
Necesito Asesoría integral de acompañamiento actuarial,,Consultoria,,,,
Necesito ayuda,,No Topic,,,,
Necesito ayuda en Integración y Depuración de Datos,,Consultoria,,,,
Necesito ayuda. Me puede enviar una cotizacion para un estudio actuarial,,Jubilacion Patronal,,,,
necesito contactarme con ustedes,,Contacto,,,,
necesito cotizacion ,,No Topic,,,,
necesito cotización para un estudio actuarial.   Que información necesita para enviarme una proforma.,,Jubilacion Patronal,empresa,0,,
Necesito Desarrollo y aplicación de solvencia para compañías aseguradoras por tipos de riesgo,,Consultoria,,,,
Necesito Diseño y acompañamiento en la aprobación de nuevos productos y planes de seguros,,Consultoria,,,,
Necesito el cálculo de tarifas de riesgo y comerciales en los diferentes productos de seguro ,,Consultoria,,,,
Necesito el cálculo de tarifas de riesgo y comerciales en los planes de medicina prepagada,,Consultoria,,,,
necesito el correo electronico de actuaria,,Contacto,,,,
"necesito hacer un estudio actuarial de la empresa
por eso los estoy contactando",,Jubilacion Patronal,,,,
necesito hacer una consulta para poder cuantificar la obligación de beneficios para personal que está próximo a Jubilarse. con quién puedo contactarme?,,Contacto,empresa,,,ambivalente
necesito hacer una consulta para poder cuantificar la obligación de beneficios para personal que está próximo a Jubilarse. con quién puedo contactarme?,,Jubilacion Patronal,,,,ambivalente
necesito hacer una consulta para poder cuantificar la obligación de beneficios para personal que está próximo a Jubilarse. con quién puedo contactarme?,,IESS,,,,ambivalente
Necesito informacion sobre su producto ACTUA R2O,,Consultoria,,,,
Necesito informacion sobre su producto de asesoria financiera,,Otros servicios,,,,
necesito me ayude con informacion tengo una nomina de 18 trabajadores pero dentro de ellos un persona de 80años que  necesito jubilarlo cual seria el costo  si usted me ayudaraia con el calculo,,Jubilacion Patronal,empresa,0,,
Necesito Provisión de las reservas  DE Desviación de siniestralidad,,Consultoria,,,,
Necesito Provisión de las reservas  DE Insuficiencia de primas,,Consultoria,,,,
Necesito Provisión de las reservas  DE Metodologías alternas de cálculo para IBNR,,Consultoria,,,,
Necesito Provisión de las reservas  DE Reservas Matemáticas,,Consultoria,,,,
Necesito Provisión de las reservas  DE Riesgos en curso,,Consultoria,,,,
Necesito Provisión de las reservas  DE Servicios en curso,,Consultoria,,,,
Necesito Provisión de las reservas  DE Servicios pendientes avisados,,Consultoria,,,,
Necesito Provisión de las reservas  DE Servicios prestados y no reportados,,Consultoria,,,,
Necesito Provisión de las reservas  DE Siniestros pendientes avisados,,Consultoria,,,,
Necesito Provisión de las reservas IBNR,,Consultoria,,,,
"Necesito q me ayude indicando si uds realizan analisis y diagnostico de la estructura organizacional, evaluar nuestro organigrama y como estamos gestionandolo para ver si estamos bien o lsi hay manera de ser mas eficiente o mejorsr procesos",,Otros servicios,,,,
Necesito q me ayudes con algo por favor.,,No Topic,,,,
Necesito q me ayudes con algo por favor. Dan servicio de consultoria para empresas de seguros?,,Consultoria,,,,
necesito que me ayuden con un analisis actuarial de mi Institucion,,Jubilacion Patronal,,,,
"necesito realizar una consulta sobre los porcentajes rrc  a aplicar en este periodo, los q rigen a partir del abril 2019","Buenos días 
me ayuda con los siguientes datos por favor: ruc, nombre empresa, contacto, cargo, correo y teléfonos ",Consultoria,empresa,0,,
necesito saber,,No Topic,,,,
NECESITO SABER CUANTO,,No Topic,,,,
"necesito saber que dia me emitieron la factura 
mi ruc es 0992592605001 ",,Facturacion/Retencion/Cobros,,,,
NECESITO SABER QUE PAPELES NECESITAN PARA REALIZAR UN TRABAJO DE SUS SERVICIOS DE LA COMPAÑIA,,No Topic,,,,
Necesito saber que se necesita para contratar a un actuario. Soy representante legal de dos colegios y necesito manejar el ahorro para las liquidaciones y jubilaciones,,Jubilacion Patronal,,,,ambivalente
Necesito saber que se necesita para contratar a un actuario. Soy representante legal de dos colegios y necesito manejar el ahorro para las liquidaciones y jubilaciones,,Renuncia/Despido/Desahucio,,,,ambivalente
Necesito servicios de analítica de datos,,Consultoria,,,,
necesito servicios de capacitacion en temas financieros ,,Charlas/Capacitaciones,,,,
necesito servicios de capacitacion para obtener conocimientos en ciencias actuariales,,Charlas/Capacitaciones,,,,
necesito su ayuda quisiera saber cual es el asiento para la contabilizacion del estudio actuarial gracias nosotros hicimos el estudio con uds.,,Jubilacion Patronal,empresa,0,,
"Necesito un estudio actuarial para provicion por jubilaciones, es para una empresa de servicios educativos ",,Jubilacion Patronal,empresa,0,,
Necesito un estudio de balance actuarial para un fondos que mantienen un sistema de reparto. ,,Consultoria,,,,
Necesito un estudio para una migración a un sistema de cuentas individuales,,Consultoria,,,,
Necesito un estudios de balance actuarial para  un fondos que mantienen un sistema de beneficio definido ,,Consultoria,,,,
Necesito una consultoria de Evaluación de Calidad de Datos,,Consultoria,,,,
necesito una cotizacion para un estudio actuarial de 73 empleados,,Jubilacion Patronal,,,,
Necesito una Herramienta que permite tarificar de manera eficiente el plan de seguro o medicina prepagada tomando en cuenta los diversos factores que pueden afectar el riesgo,,Consultoria,,,,
NO ES PARA LO DEL IESS,,IESS,,,,
"No estoy contenta con los plazos, quisiera presentar una queja",,Queja,,NP,,
NO ME RESPONDEN EL TELEFONO EN ACTUARIA...TALVEZ HAY OTRO NUMERO AL QUE PUEDO LLAMAR?,,Contacto,,,,
NOMBRE:DOLORES,,No Topic,,,,
nos gustaria obtener una proforma acerca de los servicios de calculo por jubilación,,Jubilacion Patronal,,,,
nos podría ayudar por favor,,No Topic,,,,
"nose si puedo hacer una consulta por este medio, el tema es que llevo 19 años de servicio con el mismo patrón pero aquí no les permiten llegar a los 20 años por temas de jubilación patronal me gustaría que me asesoren cuanto me tocaría recibir    porque es seguro que me botan",,Jubilacion Patronal,,,,
Nuestros programas atienden necesidades básicas de capacitación en la empresa.,,Charlas/Capacitaciones,,,,
Ok gracias! Dan Asesoría en Guayaquil y Quito? En dónde están ubicados en GYE?,,Contacto,,,,
ok y la pension jubilar no entiendo lo de la raiz sesentava del total de los sueldos de los ultimos 5 años,,IESS,,,,
"Ok, muchas gracias, ",,Hi Five,,,,
Ola...mi pregunta es si mi mamá está enferma puedo yo reclamarle su liquidación y presentarle su renuncia,,Renuncia/Despido/Desahucio,,,,
otro tema,,No Topic,persona,,,
PARA CALCULAR EL DESAHUCIO SE DEBE TOMAR EN CUENTA EL VALOR POR HORAS EXTRAS Y LA ALIMENTACIÓN?,,Renuncia/Despido/Desahucio,persona,0,,
"PARA EL CALCULO DE LA JUBILACION IESS POR INVALIDEZ O DISCAPACIDAD
TRABAJABA EN DOS EMPLEOS PARA EL CALCULO DE LA JUBILACION SE ME VA HA CONSIDERAR LAS DOS, APORTACIONES. INCLUIDO LOS ADICIONALES, COMO HORAS EXTRAS COMISIONES ETC., INDISTINTAMEMETE, QUE ME CONSIDEREN SOLO UNA IMPOSICION PARA MI HISTORIA LABORAL. QUIERO SABER DONDE ENCONTAR LA BASE LEGAL, SUS ARTICULO SOBRE ESTE CASO",,IESS,,,,
"para el registro del estudi actuarial, los gastos son considerados como no deducible pero directamente va a afectar a mi resultado?",,Jubilacion Patronal,persona,0,,
